{
  "assumptions": [
    "The declared contract and environment delimit the result."
  ],
  "candidate_source_hash": "sha256:94c0b8475a1798fe8c8610c4533df729ec2c71d406a76073bc43e145852d9ce2",
  "completed_at": "2026-07-25T12:00:01Z",
  "component_identity": {
    "identity_hash": "sha256:94c0b8475a1798fe8c8610c4533df729ec2c71d406a76073bc43e145852d9ce2",
    "name": "repaired-bounded-index",
    "version": "1.0.0"
  },
  "contract_id": "example.select.v1",
  "environment": {
    "fingerprint": "sha256:bec2072576f16c4fc1cb89d286b8a29b8035f5e83b6b946c4180b7928dbc1679",
    "identity_evidence_id": "identity-environment"
  },
  "evaluator": {
    "identity_evidence_id": "identity-evaluator",
    "identity_hash": "sha256:8c6dcf0b337eba166957055f8e0fceab18b864868f1a7274f65f5247afbb57f8",
    "name": "mncs-example-evaluator",
    "version": "1.0"
  },
  "evidence_references": [
    "contract",
    "reference",
    "machine",
    "identity-evaluator",
    "identity-environment"
  ],
  "extensions": {},
  "gate_kind": "mutation",
  "limitations": [
    "Illustrative local evidence; no accredited assurance claim."
  ],
  "mncs_version": "0.1",
  "observation_counts": {
    "failed": 0,
    "passed": 4,
    "total": 4,
    "unknown": 0
  },
  "reference_source_hash": "sha256:83d7dba632999122e544fb77f81118ef4fafd32ace2026f2eabd36c5e02a0e0a",
  "result_id": "gate-mutation",
  "schema_version": "0.1.1",
  "started_at": "2026-07-25T12:00:00Z",
  "status": "PASS"
}
